{
  "schema_name": "CommercializationReadinessV1",
  "schema_version": "1.0.0",
  "record_id": "commercialization-synthetic-v1",
  "components": [
    {"category": "application_code", "subject": "synthetic framework", "status": "verified_clear"},
    {"category": "base_model", "subject": "synthetic model", "status": "not_applicable"},
    {"category": "checkpoint", "subject": "synthetic package", "status": "restricted", "limitations": ["No weights are distributed."]},
    {"category": "training_data", "subject": "synthetic inputs", "status": "not_applicable"},
    {"category": "evaluation_data", "subject": "synthetic labels", "status": "verified_clear"},
    {"category": "media", "subject": "no media", "status": "not_applicable"},
    {"category": "hosted_api", "subject": "local execution", "status": "not_applicable"},
    {"category": "codec", "subject": "no rendering", "status": "not_applicable"},
    {"category": "output_redistribution", "subject": "JSON fixtures", "status": "verified_clear"}
  ],
  "overall_status": "restricted",
  "reviewed_at": "2026-08-21T00:00:00Z"
}
